  <?xmlversion ="1.0" encoding="utf-8"?>
 <!-- <?xml-stylesheet href="xslFajl.xslt"?>-->
  <!DOCTYPE Adresar SYSTEM "adresarDTD.dtd">

  <Adresar
     xmlns:xsi="http://www.w3.org/2001/XMLSchema-instance">
    <Osoba idOsoba="o1">
     <punoIme>
      <ime>Aleksandar</ime>
      <srednjeIme>Slavko</srednjeIme>
      <prezime>Dikic</prezime>
      </punoIme> 
      <datumRodjenja>
        <dan>11</dan>
          <mesec>4</mesec>
        <godina>1997</godina>
     </datumRodjenja>
     <adresa tipAdrese='privremena'>
        <ulica>Sutjeska</ulica>
        <broj>324</broj>
        <grad>Beograd</grad>
        <drzava>Srbija</drzava>      
     </adresa>
     <brojTelefona tipTelefona='moblini'>0654647131</brojTelefona>
     <eMail tipEmail='sluzbeni'>aleks1@gmail.com</eMail>
      <eMail tipEmail='sluzbeni'>aleks2@gmail.com</eMail>
      <eMail tipEmail='sluzbeni'>aleks3@gmail.com</eMail>
    </Osoba>

    <Osoba idOsoba='o2'>
      <punoIme>
        <ime>Marko</ime>
        <prezime>Markovic</prezime>
       </punoIme>
      <datumRodjenja>
        <dan>20</dan>
        <mesec>3</mesec>
        <godina>1992</godina>
      </datumRodjenja>
      <adresa tipAdrese='stalna'>
        <ulica>Susag</ulica>
        <broj>21</broj>
        <grad>Beograd</grad>
        <drzava>Srbija</drzava>
      </adresa>
      <brojTelefona tipTelefona='moblini'>
        0654647131
      </brojTelefona>
      <eMail tipEmail='sluzbeni'>
        asalic97@gmail.com
      </eMail>
    </Osoba>

    <Osoba idOsoba='o3'>
      <punoIme>
        <ime>Pera</ime>
        <prezime>Peric</prezime>
      </punoIme>
      <datumRodjenja>
        <dan>20</dan>
        <mesec>3</mesec>
        <godina>2009</godina>
      </datumRodjenja>
      <adresa>
        <ulica>Susag</ulica>
        <broj>21</broj>
        <grad>Beograd</grad>
        <drzava>Srbija</drzava>
      </adresa>
      <brojTelefona tipTelefona='moblini'>
        0654647131
      </brojTelefona>
      <eMail tipEmail='sluzbeni'>
        asalic97@gmail.com
      </eMail>
    </Osoba>
    
    
    <Kompanija idKompanija='k1'>
      <naziv>Speedy korporacija</naziv>
      <adresa tipAdrese='stalna'>
       <ulica>Francuska</ulica>
       <broj>13</broj>
       <grad>Beograd</grad>
       <drzava>Srbija</drzava>      
     </adresa>
     <brojTelefona tipTelefona='fiksni'>011/521532</brojTelefona>
     <eMail tipEmail='sluzbeni'>kompanija@speedy.com</eMail>   
    </Kompanija>

   

    <Kompanija idKompanija='k2'>
      <naziv>Speedy korporacija druga</naziv>
      <adresa>
        <ulica>Makedonska</ulica>
        <broj>54</broj>
        <grad>Beograd</grad>
        <drzava>Srbija</drzava>
      </adresa>
      <brojTelefona tipTelefona='fiksni'>011/521321</brojTelefona>
      <eMail tipEmail='sluzbeni'>kompanija@speedy.com</eMail>
      <eMail tipEmail='sluzbeni'>kompanija@speedy.com</eMail>
      <eMail tipEmail='sluzbeni'>kompanija@speedy.com</eMail>
    </Kompanija>

    <Kompanija idKompanija='k3'>
      <naziv>Kompanija 3</naziv>
      <adresa>
        <ulica>Ulica</ulica>
        <broj>5443</broj>
        <grad>Beograd</grad>
        <drzava>Srbija</drzava>
      </adresa>
      <brojTelefona tipTelefona='fiksni'>011/521321</brojTelefona>
      <eMail tipEmail='sluzbeni'>kompanija1@mail.com</eMail>
      <eMail tipEmail='sluzbeni'>kompanija2@speedy.com</eMail>
      <eMail tipEmail='sluzbeni'>kompanija3@speedy.com</eMail>
    </Kompanija>
    
  </Adresar>